Country,Year,Indicator,Value,Unit
Kenya European Holdings, 1930, Machinery for working the soil: Ploughs, animal draught (Absolute data), 5,611,Number
Kenya European Holdings, 1930, Machinery for working the soil: Ploughs, steam and motor power (Absolute data), 669,Number
Kenya European Holdings, 1930, Machinery for working the soil: Harrows (Absolute data), 4,002,Number
Kenya European Holdings, 1930, Machinery for working the soil: Cultivators (Absolute data), 6,505,Number
Kenya European Holdings, 1930, Machinery for working the soil: Rollers (Absolute data), 372,Number
