Country,Year,Indicator,Value,Unit
Pakistan,1960-1962,Number of Holdings fully owned,5 728 846,Number
Pakistan,1960-1962,Area of Holdings fully owned,5 728 846,Hectares
Pakistan,1960-1962,Number of Holdings rented from others,2 128 030,Number
Pakistan,1960-1962,Area of Holdings rented from others,7 865 842,Hectares
Pakistan,1960-1962,Number of Holdings operated under mixed forms of tenure,3 142 587,Number
Pakistan,1960-1962,Area of Holdings operated under mixed forms of tenure,8 434 101,Hectares
