Country,Year,Indicator,Value,Unit
Latvia,1930,Area of agricultural holdings,10 849 659,acres
Latvia,1930,State forests (area owned by Department of Forestry),3 426 517,acres
Latvia,1930,Other non-agricultural areas (owned by Department of Forestry),882 236,acres
Latvia,1930,Total area owned by the Department of Forestry,4 308 753,acres
Latvia,1930,Area of communal forests (of Riga),75 489,acres
Latvia,1930,Miscellaneous areas intended but not yet utilized for agriculture,55 745,acres
Latvia,1930,Total area of landed properties,15 289 876,acres
Latvia,1930,Other areas,967 772,acres
Latvia,1930,Total area of Latvia,16 257 648,acres